{
  "contract": "app-views/v1",
  "app": "social-content",
  "title": "Social Content — caption runs",
  "summary": "Data-only view declarations a Social Content package could ship: a reviewed-caption run table, a run detail, and a disabled preview of the host's caption form.",
  "views": [
    {
      "id": "caption-runs",
      "title": "Caption runs",
      "kind": "table",
      "fields": [
        { "id": "subject", "label": "Subject", "format": "text" },
        { "id": "channel", "label": "Channel", "format": "enum", "values": ["instagram", "facebook"] },
        { "id": "status", "label": "Status", "format": "enum", "values": ["draft", "in_review", "released"] },
        { "id": "caption", "label": "Caption", "format": "text" },
        { "id": "tags", "label": "Tags", "format": "tags", "kind": "list" }
      ],
      "columns": [
        { "field": "subject" },
        { "field": "channel" },
        { "field": "status" },
        { "field": "caption" },
        { "field": "tags" }
      ]
    },
    {
      "id": "caption-detail",
      "title": "Caption run detail",
      "kind": "detail",
      "fields": [
        { "id": "subject", "label": "Subject", "format": "text" },
        { "id": "channel", "label": "Channel", "format": "enum", "values": ["instagram", "facebook"] },
        { "id": "status", "label": "Status", "format": "enum", "values": ["draft", "in_review", "released"] },
        { "id": "reviewed_at", "label": "Reviewed at", "format": "datetime" },
        { "id": "caption", "label": "Caption", "format": "text", "createView": "caption-form" }
      ]
    },
    {
      "id": "caption-form",
      "title": "New caption run (preview)",
      "kind": "form",
      "previewOf": [
        { "id": "subject", "label": "Subject", "format": "text" },
        { "id": "channel", "label": "Channel", "format": "enum", "values": ["instagram", "facebook"] },
        { "id": "source", "label": "Source facts", "format": "text" },
        { "id": "brand_voice", "label": "Brand voice", "format": "text" }
      ]
    }
  ]
}
